<?xml version="1.0" encoding="UTF-8"?>
DIDN'T GET THIS WORKING - taking data from CSV file creates a Db shape XML msg
<!-- New document created with EditiX at Tue Oct 14 15:42:17 BST 2008 -->

<Applic  xmlns:xsi="http://www.w3.org/2001/XMLSchema-instance" xsi:noNamespaceSchemaLocation="Applic.xsd">
	<Params>
		<ExternalShell>sh</ExternalShell>
	</Params>
	<Input>
		<InputSource>
			<InputLimit>1</InputLimit>
			<DataFormat>CSV</DataFormat>
			<InputFile>
				<FileDir>D:\eclipseWorkspaces\workspace\GeMHa\data\</FileDir>
				<FileNameFilter>Batchuler_Failure_Report_CSV_[0-9]*.txt</FileNameFilter>
				<CSVParams>
					<FieldSeparator>\t</FieldSeparator>
					<MaxRecsPerMessage>1</MaxRecsPerMessage>
					<ColumnOrder>
						<Column>ERRORID</Column>
						<Column>ERRORCODE</Column>
						<Column>ERRORSUBCODE</Column>
						<Column>NOTIFICATIONMESSAGE</Column>
					</ColumnOrder>
					<XMLFormat>insert</XMLFormat>
				</CSVParams>
			</InputFile>
		</InputSource>
		<InputValidation SchemaValidation="off" SchemaDefinitionFileName="/mv1/delv/middleware/CRDB/apps/mqXmq/data/sorts_transfer_service_order_to_delivery.xsd"/>
	</Input>
	<Output>
<!-- 
		<OutputHTTP>
			<ServerUrl>HTTP://localhost:8080</ServerUrl>
			<EndPointName>RegisterNotifiedDeviceServlet</EndPointName>
		</OutputHTTP>
 -->
		<OutputFile>
			<FileNameTemplate>responses/response_*_?.xml</FileNameTemplate>
		</OutputFile>
	</Output>
	<Processing>
		<MessageProcessingClassName>gemha.servers.LwProcessMessageDoNothing</MessageProcessingClassName>
				<ResponseMainDocElementName>RexRunNotification</ResponseMainDocElementName>
		<SendElements>
			<ElementName>/MESSAGE/DBACTION</ElementName>
		</SendElements>
<!-- 
		<ResponseLiterals>
			<ResponseLiteral Location='/RexRunNotification/TargetApplicationName'>RexBark</ResponseLiteral>
			<ResponseLiteral Location='/RexRunNotification/Source'>batchuler</ResponseLiteral>
			<ResponseLiteral Location='/RexRunNotification/SourceMsgType'>error</ResponseLiteral>
			<ResponseLiteral Location='/RexRunNotification/RecipientList'>ingelsc;wadel</ResponseLiteral>
		</ResponseLiterals>
 -->
	</Processing>
	<Auditing>
		<AuditKeys ActionOnError="shutdown">
			<KeyName>/MESSAGE/DBACTION/INSERT/COLUMNS/ERRORID</KeyName>
		</AuditKeys>
		<AuditKeysSeparator>-</AuditKeysSeparator>
	</Auditing>
	<Logging>
		<Level>
			<GeneralLoggingLevel>FINEST</GeneralLoggingLevel>
		</Level>
		<LogFileDir>D:\eclipseWorkspaces\workspace\GeMHa\logs\</LogFileDir>
		<LogFileNameTemplate>LwGenericMessageHandler.log</LogFileNameTemplate>
		<ShutDownLogFileNameTemplate>LwGenericMessageHandler_shutdown.log</ShutDownLogFileNameTemplate>
	</Logging>
</Applic>
