<?xml version="1.0" encoding="UTF-8"?>
<Applic xmlns:xsi="http://www.w3.org/2001/XMLSchema-instance" xsi:noNamespaceSchemaLocation="Applic.xsd">
  <Params>
    <ExternalShell>ExternalShell</ExternalShell>
  </Params>
  <Input>
    <InputSource>
      <DataFormat>XML</DataFormat>
    </InputSource>
  </Input>
  <Output>
    <OutputQueue>
      <QueueName>QueueName</QueueName>
    </OutputQueue>
  </Output>
  <Processing>
    <MessageProcessingClassName>MessageProcessingClassName</MessageProcessingClassName>
    <SendElements>
      <ElementName>ElementName</ElementName>
    </SendElements>
  </Processing>
  <Auditing/>
  <Logging/>
</Applic>
