<?xml version="1.0" encoding="UTF-8"?>

<!-- New document created with EditiX at Tue Oct 14 15:42:17 BST 2008 -->

<Applic  xmlns:xsi="http://www.w3.org/2001/XMLSchema-instance" xsi:noNamespaceSchemaLocation="Applic.xsd">
	<Params>
		<ExternalShell>sh</ExternalShell>
	</Params>
	<Input>
		<InputSource>
			<InputLimit>7</InputLimit>
			<DataFormat>CSV</DataFormat>
			<InputFile>
				<FileDir>data\</FileDir>
				<FileNameFilter>input_CSV_[0-9]*.txt</FileNameFilter>
				<CSVParams>
					<FieldSeparator>\t</FieldSeparator>
					<MaxRecsPerMessage>2</MaxRecsPerMessage>
					<NumRecordsToSkip>1</NumRecordsToSkip>
					<ColumnOrder>
						<Column>USERID</Column>
						<Column>USERCODENAME</Column>
						<Column>USERSTATUS</Column>
						<Column>ADMINCOMMENT</Column>
						<Column>UPDATEDATETIME</Column>
					</ColumnOrder>
					<XMLFormat>insert</XMLFormat>
					<InsertParams>
						<Action_On_Error>EXCEPTION</Action_On_Error>
						<Prepared_Statement_Name>LW_delme1_insert_001</Prepared_Statement_Name>
						<Immediate_Commit>true</Immediate_Commit>
					</InsertParams>
				</CSVParams>
			</InputFile>
		</InputSource>
		<InputValidation SchemaValidation="off" SchemaDefinitionFileName="C:\Users\wadel\git\GeMHa\GeMHa\someMessage.xsd"/>
	</Input>
	<Output>
		<OutputFile>
			<FileNameTemplate>responses/response_*_?.xml</FileNameTemplate>
		</OutputFile>
	</Output>
	<Processing>
		<MessageProcessingClassName>gemha.servers.ProcessMessageDoNothing</MessageProcessingClassName>
		<SendElements>
			<ElementName>/MESSAGE/DBACTION</ElementName>
		</SendElements>
	</Processing>
	<Auditing>
		<AuditKeys>
			<KeyName>/MESSAGE/DBACTION/INSERT/COLUMNS/USERID</KeyName>
			<KeyName>/MESSAGE/DBACTION/INSERT/COLUMNS/USERCODENAME</KeyName>
		</AuditKeys>
		<AuditKeysSeparator>-</AuditKeysSeparator>
	</Auditing>
	<Logging>
		<Level>
			<GeneralLoggingLevel>FINEST</GeneralLoggingLevel>
		</Level>
		<LogFileDir>logs\</LogFileDir>
		<LogFileNameTemplate>GenericMessageHandler.log</LogFileNameTemplate>
		<ShutDownLogFileNameTemplate>GenericMessageHandler_shutdown.log</ShutDownLogFileNameTemplate>
	</Logging>
</Applic>
