<?xml version="1.0" encoding="UTF-8"?>

<!-- New document created with EditiX at Tue Oct 14 15:42:17 BST 2008 -->

<Applic  xmlns:xsi="http://www.w3.org/2001/XMLSchema-instance" xsi:noNamespaceSchemaLocation="Applic.xsd">
	<Params>
		<ExternalShell>sh</ExternalShell>
	</Params>
	<Input>
		<InputSource>
			<InputLimit>1000</InputLimit>
			<DataFormat>XML</DataFormat>
			<InputQueue>
				<QueueManagerName>QMA_DPWDEV02</QueueManagerName>
				<QueueName>DELIVERY_DEV_ERROR</QueueName>
				<MilliSecondsBeforeQuiet>3000</MilliSecondsBeforeQuiet>
			</InputQueue>
		</InputSource>
		<InputValidation SchemaValidation="off" SchemaDefinitionFileName="/mv1/delv/middleware/CRDB/apps/mqXmq/data/sorts_transfer_service_order_to_delivery.xsd"/>
	</Input>
	<Output>
		<OutputQueue>
			<QueueManagerName>QMA_DPWDEV02</QueueManagerName>
			<QueueName>DELIVERY_DEV_ERROR</QueueName>
			<ReplyToQueueManagerName>DELIVERY_DEV_INPUT_88</ReplyToQueueManagerName>
			<ReplyToQueueName>QMA_SUNDEV33</ReplyToQueueName>
		</OutputQueue>
	</Output>
	<Processing>
		<MessageProcessingClassName>EirProcessMessageDoNothing</MessageProcessingClassName>
		<MindElements>
			<ElementName>MESSAGE/C0</ElementName>
			<ElementName>MESSAGE/XBCCTL</ElementName>
		</MindElements>
		<SendElements>
			<ElementName>MESSAGE/DELV/ORD</ElementName>
		</SendElements>
		<TargetMainDocElementName>TIS_REQUEST</TargetMainDocElementName>
		<ResponseMainDocElementName>MESSAGE_RESPONSE</ResponseMainDocElementName>
		<ResponseLiterals>
			<ResponseLiteral Location="MESSAGE_RESPONSE/C0/TSYS">TIS</ResponseLiteral>
			<ResponseLiteral Location="MESSAGE_RESPONSE/C0/RSYS">BND</ResponseLiteral>
		</ResponseLiterals>
	</Processing>
	<Auditing>
		<AuditKeys>
			<KeyName>MESSAGE/DELV/ORD/SERVICE_ORDER_NUMBER</KeyName>
			<KeyName>MESSAGE/DELV/ORD/MAIN_NATIONAL_DEST_CODE</KeyName>
			<KeyName>MESSAGE/DELV/ORD/MAIN_TELEPHONE_NO</KeyName>
		</AuditKeys>
		<AuditKeysSeparator>-</AuditKeysSeparator>
	</Auditing>
	<Logging>
		<Level>
			<EnvironmentLoggingLevel>Development</EnvironmentLoggingLevel>
		</Level>
		<LogFileDir>/mv1/delv/middleware/CRDB/apps/mqXmq/</LogFileDir>
		<LogFileNameTemplate>EirGenericMessageHandler.log</LogFileNameTemplate>
		<ShutDownLogFileNameTemplate>EirGenericMessageHandler_shutdown.log</ShutDownLogFileNameTemplate>
	</Logging>
</Applic>
