<?xml version="1.0" encoding="UTF-8"?>

<!-- New document created with EditiX at Tue Oct 14 15:42:17 BST 2008 -->

<Applic  xmlns:xsi="http://www.w3.org/2001/XMLSchema-instance" xsi:noNamespaceSchemaLocation="Applic.xsd">
	<Params>
		<ExternalShell>sh</ExternalShell>
	</Params>
	<Input>
		<InputSource>
			<InputLimit>3</InputLimit>
			<DataFormat>XML</DataFormat>
			<InputFile>
				<FileDir>data/</FileDir>
				<FileNameFilter>B_insert_[0-9]*.xml</FileNameFilter>
			</InputFile>
		</InputSource>
		<InputValidation SchemaValidation="off" SchemaDefinitionFileName="/mv1/delv/middleware/CRDB/apps/mqXmq/data/sorts_transfer_service_order_to_delivery.xsd"/>
	</Input>
	<Output>
		<OutputQueue>
			<QueueManagerName>QMA_DPWDEV02</QueueManagerName>
			<QueueName>DELIVERY_DEV_ERROR</QueueName>
		</OutputQueue>
	</Output>
	<Processing>
		<MessageProcessingClassName>EirProcessMessageDoNothing</MessageProcessingClassName>
		<SendElements>
			<ElementName>MESSAGE/DBACTION</ElementName>
		</SendElements>
	</Processing>
	<Auditing>
		<AuditKeys ActionOnError="shutdown">
			<KeyName>MESSAGE/DBACTION/KEY</KeyName>
		</AuditKeys>
		<AuditKeysSeparator>-</AuditKeysSeparator>
		<ErrorFiles>
			<ErrorFilesDir>data</ErrorFilesDir>
			<ErrorFileNameTemplate>ErrorMessage_*_?.xml</ErrorFileNameTemplate>
		</ErrorFiles>
	</Auditing>
	<Logging>
		<Level>
			<GeneralLoggingLevel>FINEST</GeneralLoggingLevel>
		</Level>
		<LogFileDir>/mv1/delv/middleware/CRDB/apps/mqXmq/</LogFileDir>
		<LogFileNameTemplate>EirGenericMessageHandler_FtoQ_002.log</LogFileNameTemplate>
		<ShutDownLogFileNameTemplate>EirGenericMessageHandler_shutdown_FtoQ_002.log</ShutDownLogFileNameTemplate>
	</Logging>
</Applic>
